estrofes,emocao
estr vid puls secreçã hal vid exal pequen mort sex asces acas sort necess desej esperanc perd,tristeza
explod vid sang suor esperm algum instant desert habit,tristeza
estrof derradeir merencór revel histór amor perd lua rond natur,tristeza
solidár tristez nuvens escond cantor fal lua histór igual,tristeza
amor fug diss ais convuls soluc estrof repet,tristeza
etern cicatriz quas feliz barr amor ermo barr mort term,tristeza
perspect possibil escolh melhor pra vid ger revolt cabec comun marginaliz sociedad,tristeza
perspect possibil escolh melhor pra vid ger revolt cabec comun marginaliz sociedad cal escond condomíni lei favel imper genocídio,tristeza
olh pens saudad mat,tristeza
famíl necessári polít necessári necessári necessário,tristeza
favel senzal corrent velh trib sal cel prisioneir grad víd sol nasc quadr gent pag gent pag gent pag gent pag,tristeza
flech pass rent cantor implor bis car ment fei miss gaivot voand céu letr fiz solidã pra feliz,tristeza
fom continental misér nort traz fom mort fom paz,tristeza
fragil vid viv razã explic entend encar clar escond,tristeza
gel solidã dás coraçã vid mort lucidez desatin,tristeza
gent ama escrit coraçã pirrac perd grac,tristeza
gent ama car fic chor escond perd amor jog azar,tristeza
gent pens compreend distingu alma escuridã arrisc pens pra decifr,tristeza
gent pens compreend distingu alma escuridã arrisc pens pra decifr,tristeza
arrebent tant moment hom vag lut percorr,tristeza
gent brig brig pens sofr termin,tristeza
gent peg gent entreg gent morr ninguém sofr formos mulh,tristeza
gent pod convers inteir pod deix luz aces inteir esquec tir cabec merec atença,tristeza
gent quas quer lembr notic deu vontad volt,tristeza
gent acostum gent habitu dorm rua gent habitu,tristeza
gent sent acab encant paixã sum sentiment coraçã descobr med cont amor mim acab fing sent amar,tristeza
gent esperanc viv gent cant sofr fiz samb perd diz ninguém senã,tristeza
gent resist volt barc sent deix cumpr,tristeza
gent cultiv lind roseir eis cheg rod viv carreg roseir pra,tristeza
gent igual pingent fic quent cab sent vid servent rent pent corr frenét dig,tristeza
pra evit fadig xing preguic lig vaaaaa are ciment maaaa desdobr jã disposiçã sobr bundã cobr patrã cobr,tristeza
ging comadr acontec cop embriag,tristeza
hom violent violent agressã social mat sentiment favel human cri defes,tristeza
índi negr quadr social igual discrimin acredit mort sociedad fantoch pobr sábi humild excluíd vier afast extrem lest sobrevivent violênc urban,tristeza
hipocris homens nasc revolt class pobr sombr maldad negr vent sopr cabel trist,tristeza
pur verd olhos pod unir arrog atrapalh ingenu ceg juventud pass ros morr amar,tristeza
histór negr diferent palavr pra sent,tristeza
histór carr alegr chei content atropel indiferent neg,tristeza
histór carr alegr chei content atropel indiferent neg,tristeza
human desuman chanc sol nasc pra,tristeza
insensatez coraçã cuid chor dor amor,tristeza
amor delic frac desalm coraçã amou merec amad,tristeza
inteligent film tráfic sac trint chacin gramp ameac orelhã comunitári morador depor fin,tristeza
lagrim escorr rost madrug entristec sobr infeliz vid rival mordom destac lux condiçã precár tio viadut,tristeza
vid continu sent dor realidad ausenc machuc mã sint saudad pass tenebr inocenc sorris cheg filh,tristeza
lágrim escorr peit direit alguém pec pra pens traz olhar fac convém pec pra pens traz olhar fac convém,tristeza
lágrim rol olhar trist mort cheir cor sang lágrim sang viatur aproxim comec desesper lágrim sang vou sobr fic inteir,tristeza
portug esquec destin fad portug esquec destin fad,tristeza
linh ocup sinal demor abrir carr enguic chor sorr,tristeza
louc escorreg lençó cheg sonh amant rouc regal bemó troc brilhant,tristeza
louc esperanc irmã caind danc vid cant venc escravidã,tristeza
abol paz aboliçã paz ced paz conquist,tristeza
lu part cant paisag cruel cidad long favel arranh céus,tristeza
luz bat rost sol quent sent queim plant gent nasc algum fiz pra respost sol montanh vent mar,tristeza
luz lua beir rio voz vent pass long silênci diz saudad,tristeza
luz cabar apag mim tang vitrol cheg envelhec lembr chor,tristeza
luz fad seg corr guitarr cant voz cans diz solidã saudad,tristeza
luz morr céu perd cor anoitec amor,tristeza
luz morr céu perd cor anoitec amor amor,tristeza
luz negr destin cruel ilumin teatr cor represent papel palhac amor,tristeza
acas decid pec demor mim viv chor saudad pens olhar,tristeza
mã pra algum luz sol incomod deix cortin fech televisã deix burr burr viv jaul junt anim,tristeza
mã mantém arrum falec roup dobr fot viv ninguém morr coraçã inquilin coro flor fras sent,tristeza
mágo pra destin amarg coraçã descans perdo,tristeza
besteir fiz deix passarinh escap gaiol volt livr pra voar,tristeza
trist naçã époc podr compõ possív grup linchador,tristeza
manhã aparec jorn edit branc págin assunt cultur trânsit estanc,tristeza
mã segur martel mã deus crav fer corpo,tristeza
mã toc violã precis guerr mat mund fer terr voz cant cançã,tristeza
precis cant hin louv mort viol enluar sertã espad,tristeza
melhor esquec melhor cur víci início,tristeza
melhor escolh prov gost melhor chor cobr rost,tristeza
evit rug olhar espelh esvazi revólv pux gatilh,tristeza
melhor escond lágrim escuridã melhor enxerg escur mã,tristeza
id chã tropec acha soluçã acab dor tom analgés,tristeza
mat saudad olhar pra trás melhor mant jov escond idad melhor fug veloc idé chã,tristeza
ment don razã brig matern cheg salomã,tristeza
razã metad cort facã vend ment chor ped piedad razã,tristeza
ment doenc cobic falsidad misér injustic realidad govern desprez desigualdad menin menin ruas cidad,tristeza
ment acredit cas disfarc palpit pra enfeitic,tristeza
confus sinistr caus misér jur amor crist superior respeit gay idos pobr pret,tristeza
minhalm vend ninguém compr quis pag,tristeza
alm chor prant vaz fiqu companh,tristeza
histór termin deus conhec melhor pra mim cant chor lágrim voz soar,tristeza
histór termin deus conhec melhor pra mim cant chor lágrim,tristeza
sonh acontec alma sofr diz iri acab mim ninguém mat,tristeza
histór termin deus conhec melhor pra mim cant chor lágrim voz soar,tristeza
histór termin deus conhec melhor pra mim cant chor lágrim voz soar ire cant ire cant,tristeza
músic traz mensag chantag guerr fri fal ideolog vim fal,tristeza
gost vermelh verd amarel camar companheir amig,tristeza
pior contig mim golp armad coraçã,tristeza
dor vid inteir transform enorm agit termin mandat,tristeza
cass deport pra amad amor,tristeza
morr laialai amad amor morr,tristeza
tristez feit angúst tristez feit angúst surpres surpres feit fat,tristeza
sang olhos lam sapat fortal fortal silênci infam bast ret derram repres,tristeza
vid trist esper solidã soub jur cas,tristeza
cor motiv vergonh cor motiv vergonh irma cor motiv vergonh vergonh lut acomod,tristeza
cor motiv vergonh cor motiv vergonh irmã cor motiv vergonh vergonh lut acomod,tristeza
misér favel injustic social trafic vir espelh crianc marginal,tristeza
moedinh prat val cobr moedinh prat val cobr,tristeza
